{
  "schema_version": "1.0.0",
  "archive_id": "7268b60d-407e-4ab6-b14c-9c58c40db22f",
  "revision": 1,
  "updated_at": "2026-10-01T10:00:00Z",
  "subject": {"display_name": "林岚（虚构人物）"},
  "preferences": {"recording_mode": "balanced"},
  "entries": [
    {
      "id": "307baf0e-518b-4daa-9a61-b7a2537610ae",
      "kind": "event",
      "status": "confirmed",
      "title": "搬到新城市",
      "content": "2018 年前后，我搬到一座新城市工作。第一年常常想念旧朋友，也慢慢认识了新的邻居。",
      "when_text": "2018 年前后",
      "recorded_at": "2026-10-01T10:00:00Z",
      "updated_at": "2026-10-01T10:00:00Z",
      "version": 1,
      "sources": [{"type": "subject", "ref": "虚构访谈示例；人物确认示例，仅供测试"}],
      "visibility": "private",
      "history": []
    }
  ],
  "tombstones": []
}
